{
  "manifestVersion": 1,
  "policy": {
    "noPaidCalls": true,
    "allowRestrictedRawFilesInPublicRepo": false,
    "unityArtRoot": "Unity/Assets/Aegis/Art",
    "privateStagingRoot": "<outside-repository>/aegis-art-staging"
  },
  "assets": [
    {
      "id": "pilot_petal_gatling",
      "name": "Petal Gatling",
      "category": "tower",
      "status": "prototype_present",
      "productionStatus": "prototype_only",
      "references": ["assets/3d_turret_pbr.jpg", "assets/concepts/tower_heliostat_orchid.png"],
      "existingPrototypeFiles": ["Unity/Assets/Models/tower_prism_gatling.glb"],
      "targetPath": "Unity/Assets/Aegis/Art/Models/Towers/PetalGatling",
      "meshSource": { "provider": "none", "taskId": null, "promptRecord": null, "settingsRecord": null, "rawExportPrivatePath": null },
      "license": { "provider": "unknown", "record": null, "redistribution": "unverified", "status": "needs_review" },
      "dimensionsMeters": null,
      "pivot": null,
      "lodTriangleCounts": [],
      "textureSizes": [],
      "rigStatus": "not_applicable",
      "collisionStatus": "not_started",
      "review": { "owner": "", "notes": "Existing GLB is a starter prototype; inspect provenance, silhouette, separation, UVs, and budgets before promoting.", "approvedBy": null, "approvedDate": null }
    },
    {
      "id": "pilot_diesel_walker",
      "name": "Diesel Walker",
      "category": "enemy",
      "status": "prototype_present",
      "productionStatus": "prototype_only",
      "references": ["assets/3d_walker_pbr.jpg", "assets/enemy_mecha.jpg"],
      "existingPrototypeFiles": ["Unity/Assets/Models/enemy_diesel_walker.glb"],
      "targetPath": "Unity/Assets/Aegis/Art/Models/Enemies/DieselWalker",
      "meshSource": { "provider": "none", "taskId": null, "promptRecord": null, "settingsRecord": null, "rawExportPrivatePath": null },
      "license": { "provider": "unknown", "record": null, "redistribution": "unverified", "status": "needs_review" },
      "dimensionsMeters": null,
      "pivot": null,
      "lodTriangleCounts": [],
      "textureSizes": [],
      "rigStatus": "not_started",
      "collisionStatus": "not_started",
      "review": { "owner": "", "notes": "Existing GLB has no accepted rig/animation evidence. Check joints, deformation, and repeat-unit budget.", "approvedBy": null, "approvedDate": null }
    },
    {
      "id": "pilot_sanctum_rotunda",
      "name": "Sanctum Core Rotunda",
      "category": "sanctum",
      "status": "prototype_present",
      "productionStatus": "prototype_only",
      "references": ["assets/sanctum_core.jpg", "assets/aegis_master.jpg"],
      "existingPrototypeFiles": ["Unity/Assets/Models/sanctum_core_rotunda.glb"],
      "targetPath": "Unity/Assets/Aegis/Art/Models/Environment/Sanctum",
      "meshSource": { "provider": "none", "taskId": null, "promptRecord": null, "settingsRecord": null, "rawExportPrivatePath": null },
      "license": { "provider": "unknown", "record": null, "redistribution": "unverified", "status": "needs_review" },
      "dimensionsMeters": null,
      "pivot": null,
      "lodTriangleCounts": [],
      "textureSizes": [],
      "rigStatus": "not_applicable",
      "collisionStatus": "not_started",
      "review": { "owner": "", "notes": "Prototype exists; verify modularity, portal alignment, scale against 2-unit grid, and performance before acceptance.", "approvedBy": null, "approvedDate": null }
    },
    {
      "id": "pilot_modular_ruins",
      "name": "Modular Courtyard Ruin Kit",
      "category": "ruin-kit",
      "status": "prototype_present",
      "productionStatus": "prototype_only",
      "references": ["assets/battlefield_map.jpg", "assets/ruins_showcase_sheet.png", "assets/accent_columns_pack.jpg"],
      "existingPrototypeFiles": ["Unity/Assets/Models/accent_column_pediment.glb", "Unity/Assets/Models/accent_masonry_blocks.glb", "Unity/Assets/Models/ruin_grand_colonnade.glb"],
      "targetPath": "Unity/Assets/Aegis/Art/Models/Environment/Ruins",
      "meshSource": { "provider": "none", "taskId": null, "promptRecord": null, "settingsRecord": null, "rawExportPrivatePath": null },
      "license": { "provider": "unknown", "record": null, "redistribution": "unverified", "status": "needs_review" },
      "dimensionsMeters": null,
      "pivot": null,
      "lodTriangleCounts": [],
      "textureSizes": [],
      "rigStatus": "not_applicable",
      "collisionStatus": "not_started",
      "review": { "owner": "", "notes": "Prototype pieces exist, but a reusable kit with snapped pivots, trims, and documented module dimensions has not been accepted.", "approvedBy": null, "approvedDate": null }
    },
    {
      "id": "pilot_floral_groups",
      "name": "Perimeter Floral Groups",
      "category": "flora",
      "status": "prototype_present",
      "productionStatus": "prototype_only",
      "references": ["assets/flora_showcase_sheet.png", "assets/floral_accent_pack.jpg", "assets/aegis_master.jpg"],
      "existingPrototypeFiles": ["Unity/Assets/Models/flora_golden_chrysanthemum.glb", "Unity/Assets/Models/flora_wildflower_cluster.glb", "Unity/Assets/Models/flora_olive_tree.glb"],
      "targetPath": "Unity/Assets/Aegis/Art/Models/Flora",
      "meshSource": { "provider": "none", "taskId": null, "promptRecord": null, "settingsRecord": null, "rawExportPrivatePath": null },
      "license": { "provider": "unknown", "record": null, "redistribution": "unverified", "status": "needs_review" },
      "dimensionsMeters": null,
      "pivot": null,
      "lodTriangleCounts": [],
      "textureSizes": [],
      "rigStatus": "not_applicable",
      "collisionStatus": "not_started",
      "review": { "owner": "", "notes": "Existing models are prototypes. Validate density, atlas/material sharing, LOD, and cleared tactical cells.", "approvedBy": null, "approvedDate": null }
    }
  ],
  "materialFamilies": [
    {
      "id": "surface_warm_stone",
      "name": "Warm marble and limestone",
      "provider": "Poliigon",
      "status": "not_acquired",
      "searchBrief": ["warm veined marble", "aged limestone", "carved stone trim"],
      "licenseStatus": "not_acquired",
      "stagingPolicy": "private_only",
      "targetPath": "Unity/Assets/Aegis/Art/Materials/Stone"
    },
    {
      "id": "surface_worn_paving",
      "name": "Worn courtyard paving",
      "provider": "Poliigon",
      "status": "not_acquired",
      "searchBrief": ["worn stone paving", "cracked courtyard flagstones", "subtle height and roughness variation"],
      "licenseStatus": "not_acquired",
      "stagingPolicy": "private_only",
      "targetPath": "Unity/Assets/Aegis/Art/Materials/Paving"
    },
    {
      "id": "surface_patina_metals",
      "name": "Patinated brass, copper, and dark iron",
      "provider": "Poliigon",
      "status": "not_acquired",
      "searchBrief": ["aged brass", "patinated copper", "worn dark iron"],
      "licenseStatus": "not_acquired",
      "stagingPolicy": "private_only",
      "targetPath": "Unity/Assets/Aegis/Art/Materials/Metal"
    },
    {
      "id": "surface_ground_and_rock",
      "name": "Soil, moss, rock, and outdoor HDRI",
      "provider": "Poliigon",
      "status": "not_acquired",
      "searchBrief": ["dark soil", "moss", "alpine rock", "overcast outdoor HDRI"],
      "licenseStatus": "not_acquired",
      "stagingPolicy": "private_only",
      "targetPath": "Unity/Assets/Aegis/Art/Materials/Environment"
    }
  ]
}
